{
  "schemaVersion": "ofarm.mappingcoveragestatement.v0.1",
  "statementId": "mapping-coverage:adapt-import:v1",
  "mappingModuleRef": "mapping:adapt-import:v1",
  "direction": "IMPORT",
  "externalStandardRef": "standard:adapt:payload:v1",
  "coveredConstructs": [
    {
      "externalConstructRef": "ADAPT Field",
      "ofarmTargetRef": "scope:field and field-boundary evidence",
      "notes": "Field identity candidates normalize into OFARM structure assertions and supporting evidence first."
    },
    {
      "externalConstructRef": "ADAPT CropZone",
      "ofarmTargetRef": "crop-cycle or management-zone draft material",
      "notes": "Zone semantics require OFARM identity and lifecycle policy before promotion."
    },
    {
      "externalConstructRef": "ADAPT OperationData",
      "ofarmTargetRef": "operation claim plus execution evidence linkage"
    }
  ],
  "droppedConstructs": [
    {
      "externalConstructRef": "tool-vendor private extension attributes",
      "reasonCode": "VENDOR_VARIANT_UNSUPPORTED",
      "notes": "Retained in the raw payload as evidence but not normalized into active semantics by default."
    }
  ],
  "approximatedConstructs": [
    {
      "externalConstructRef": "ADAPT implement hierarchy detail",
      "ofarmTargetRef": "equipment/facility/container attachment references",
      "approximationClass": "NARROWING",
      "notes": "Some attachment semantics collapse into a smaller governed equipment relation model."
    }
  ],
  "requiredOfarmConceptsWithoutSource": [
    "authority basis",
    "review state",
    "materialization basis"
  ],
  "promotionPosture": {
    "defaultCommitClasses": [
      "observation assertion",
      "operation claim",
      "evidence record"
    ],
    "autoPromotionAllowed": false,
    "requiresReviewForAcceptedConsequences": true
  },
  "roundTripExpectation": "LOSS_AWARE",
  "lossMapRef": "lossmap:adapt-import:v1",
  "notes": "ADAPT ingest is normalized as governed import evidence and claims rather than accepted truth by format presence alone."
}
