{
  "schemaVersion": "ofarm.mappingcoveragestatement.v0.1",
  "statementId": "mapping-coverage:isoxml-import:v1",
  "mappingModuleRef": "mapping:isoxml-import:v1",
  "direction": "IMPORT",
  "externalStandardRef": "standard:isoxml:file:v4",
  "coveredConstructs": [
    {
      "externalConstructRef": "ISOXML Task",
      "ofarmTargetRef": "operation claim and execution evidence",
      "notes": "Task records normalize into governed operation claims rather than direct accepted operational truth."
    },
    {
      "externalConstructRef": "ISOXML Partfield",
      "ofarmTargetRef": "field scope candidate plus field-boundary evidence"
    },
    {
      "externalConstructRef": "ISOXML Product / Device references",
      "ofarmTargetRef": "material and equipment references in import context"
    }
  ],
  "droppedConstructs": [
    {
      "externalConstructRef": "manufacturer-specific diagnostics blocks",
      "reasonCode": "VENDOR_VARIANT_UNSUPPORTED",
      "notes": "Vendor diagnostics remain attached as raw evidence only."
    }
  ],
  "approximatedConstructs": [
    {
      "externalConstructRef": "task controller execution status detail",
      "ofarmTargetRef": "operation claim execution qualifiers",
      "approximationClass": "COLLAPSE",
      "notes": "Fine-grained device status detail may collapse into a smaller OFARM execution-state vocabulary."
    }
  ],
  "requiredOfarmConceptsWithoutSource": [
    "authority basis",
    "review state",
    "accepted consequence lineage"
  ],
  "promotionPosture": {
    "defaultCommitClasses": [
      "observation assertion",
      "operation claim",
      "evidence record"
    ],
    "autoPromotionAllowed": false,
    "requiresReviewForAcceptedConsequences": true
  },
  "roundTripExpectation": "LOSS_AWARE",
  "lossMapRef": "lossmap:isoxml-import:v1",
  "notes": "ISOXML ingest remains loss-aware and evidence-first."
}
